{
  "summary": "Кандидат имеет устойчивый backend-профиль на Python с коммерческим FastAPI, PostgreSQL и опытом оптимизации SQL-запросов. Английский подтвержден на уровне B1; опыт управления командой не подтвержден.",
  "strengths": [
    {
      "title": "Backend-разработка на Python",
      "explanation": "Три года backend-разработки дают подтвержденную практическую основу для Python-позиций.",
      "evidence_ids": [
        "r1"
      ]
    },
    {
      "title": "FastAPI в коммерческом сервисе",
      "explanation": "Опыт FastAPI подтвержден именно в коммерческом сервисе, а не только учебными задачами.",
      "evidence_ids": [
        "r2"
      ]
    },
    {
      "title": "PostgreSQL и SQL-оптимизация",
      "explanation": "Кандидат работал с PostgreSQL и оптимизировал SQL-запросы, что усиливает backend-профиль.",
      "evidence_ids": [
        "r3"
      ]
    },
    {
      "title": "Английский B1",
      "explanation": "Уровень английского B1 явно подтвержден во входных данных.",
      "evidence_ids": [
        "r4"
      ]
    }
  ],
  "gaps": [
    {
      "title": "Управление командой не подтверждено",
      "explanation": "Во входных данных прямо указано отсутствие подтвержденного опыта управления командой.",
      "evidence_ids": [
        "r5"
      ]
    }
  ],
  "recommendations": [
    {
      "action": "Получить подтверждаемый опыт координации",
      "rationale": "Если карьерная цель включает лидерские роли, полезно брать задачи с координацией и затем фиксировать конкретный подтверждаемый результат.",
      "evidence_ids": [
        "r5"
      ]
    },
    {
      "action": "Углублять текущий backend-стек",
      "rationale": "Развитие уже подтвержденных Python, FastAPI и PostgreSQL компетенций укрепит существующий профиль без приписывания новых навыков.",
      "evidence_ids": [
        "r1",
        "r2",
        "r3"
      ]
    },
    {
      "action": "Развивать рабочий английский",
      "rationale": "Подтвержденный уровень B1 можно последовательно улучшать для более широкого круга backend-вакансий.",
      "evidence_ids": [
        "r4"
      ]
    }
  ],
  "facts_not_verified": [
    {
      "fact": "Опыт управления командой не подтвержден.",
      "evidence_ids": [
        "r5"
      ]
    }
  ]
}
