{
  "summary": "The candidate has two years of data-analysis experience with advanced SQL, Power BI dashboards, and Excel automation. Production Python experience is explicitly not verified.",
  "strengths": [
    {
      "title": "Data analysis experience",
      "explanation": "Two years in a data analyst role provide a confirmed foundation for analytics work.",
      "evidence_ids": [
        "e1"
      ]
    },
    {
      "title": "Advanced SQL",
      "explanation": "Advanced SQL is explicitly confirmed and supports database-heavy analytics tasks.",
      "evidence_ids": [
        "e2"
      ]
    },
    {
      "title": "Power BI dashboards",
      "explanation": "Power BI dashboard experience supports reporting and data-communication work.",
      "evidence_ids": [
        "e3"
      ]
    },
    {
      "title": "Excel automation",
      "explanation": "Excel automation is a confirmed capability that can support repeatable analytical workflows.",
      "evidence_ids": [
        "e4"
      ]
    }
  ],
  "gaps": [
    {
      "title": "Production Python is unverified",
      "explanation": "The input explicitly states that production Python experience is not verified.",
      "evidence_ids": [
        "e5"
      ]
    }
  ],
  "recommendations": [
    {
      "action": "Build verifiable Python practice",
      "rationale": "If target roles require Python, create work that can be described and evidenced without presenting it as existing production experience.",
      "evidence_ids": [
        "e5"
      ]
    },
    {
      "action": "Strengthen the confirmed analytics stack",
      "rationale": "Continue developing the already confirmed SQL, Power BI, and Excel capabilities around real analytical use cases.",
      "evidence_ids": [
        "e2",
        "e3",
        "e4"
      ]
    }
  ],
  "facts_not_verified": [
    {
      "fact": "Production Python experience is not verified.",
      "evidence_ids": [
        "e5"
      ]
    }
  ]
}
